ID,Calories,name,Food Group
174529,51,Osyter Sauce,Soups and Sauces
174530,50,Low Sodium Minestrone,Soups and Sauces
174531,35,Sauce Fish Ready-To-Serve,Soups and Sauces
174532,46,Soup Shark Fin Restaurant-Prepared,Soups and Sauces
174533,81,Soup Bean & Ham Canned Reduced Sodium Prepared With Water Or Ready-To-Serve,Soups and Sauces
174534,71,Split Pea Soup Canned Reduced Sodium Prepared With Water Or Ready-To Serve,Soups and Sauces
174535,68,Split Pea With Ham Soup Canned Reduced Sodium Prepared With Water Or Ready-To-Serve,Soups and Sauces
174536,6,Soup Chicken Broth Ready-To-Serve,Soups and Sauces
174537,77,Soup Cream Of Chicken Canned Prepared With Equal Volume Milk,Soups and Sauces
174538,65,Soup Vegetable Canned Low Sodium Condensed,Soups and Sauces
174539,61,Soup Clam Chowder New England Canned Prepared With Equal Volume Low Fat (2%) Milk,Soups and Sauces
174540,65,Soup Cream Of Mushroom Canned Prepared With Equal Volume Low Fat (2%) Milk,Soups and Sauces
174541,75,Soup Cream Of Onion Canned Prepared With Equal Volume Milk,Soups and Sauces
174542,72,Sauce White Thin Prepared-From-Recipe With Butter,Soups and Sauces
174543,79,Sauce Sweet And Sour Prepared-From-Recipe,Soups and Sauces
174544,172,Sauce Barbecue Kraft Original,Soups and Sauces
174545,41,Soup Healthy Choice Chicken Noodle Soup Canned,Soups and Sauces
174546,55,Soup Tomato Canned Prepared With Equal Volume Low Fat (2%) Milk,Soups and Sauces
174547,71,Campbells Tomato Soup Condensed,Soups and Sauces
174548,47,Campbells Chunky Classic Chicken Noodle Soup,Soups and Sauces
174549,35,Cream Of Asparagus Soup,Soups and Sauces
174550,63,Soup Cheese Canned Prepared With Equal Volume Water,Soups and Sauces
174551,16,Soup Chicken Broth Canned Prepared With Equal Volume Water,Soups and Sauces
174552,56,Campbells Beef Barley Soup,Soups and Sauces
174553,48,Cream Of Chicken Soup,Soups and Sauces
174554,30,Manhattan Clam Chowder (Prepared With Equal Part Water),Soups and Sauces
174555,35,New England Clam Chowder,Soups and Sauces
174556,81,Campbells Chunky New England Clam Chowder,Soups and Sauces
174557,12,Beef Broth From Bouillon,Soups and Sauces
174558,35,Soup Mushroom With Beef Stock Canned Prepared With Equal Volume Water,Soups and Sauces
174559,44,Soup Cream Of Onion Canned Prepared With Equal Volume Water,Soups and Sauces
174560,24,Soup Oyster Stew Canned Prepared With Equal Volume Water,Soups and Sauces
174561,61,Soup Pea Green Canned Prepared With Equal Volume Water,Soups and Sauces
174562,28,Soup Turkey Noodle Canned Prepared With Equal Volume Water,Soups and Sauces
174563,30,Soup Turkey Vegetable Canned Prepared With Equal Volume Water,Soups and Sauces
174564,28,Vegetable Soup,Soups and Sauces
174565,31,Soup Vegetable Beef Canned Prepared With Equal Volume Water,Soups and Sauces
174566,5,Soup Chicken Broth Cubes Dry Prepared With Water,Soups and Sauces
174567,41,Soup Cream Of Chicken Dry Mix Prepared With Water,Soups and Sauces
174568,12,Soup Onion Dry Mix Prepared With Water,Soups and Sauces
174569,38,Soup Tomato Dry Mix Prepared With Water,Soups and Sauces
174570,115,Roast Beef Deli Style Prepackaged Sliced,Meats
174571,334,Luncheon Meat Pork Canned,Meats
174572,109,Turkey Breast Low Salt Prepackaged Or Deli Luncheon Meat,Meats
174573,311,Mortadella Beef Pork,Meats
174574,149,Peppered Loaf Pork Beef,Meats
174575,504,Pepperoni,Meats
174576,225,Pickle And Pimiento Loaf Pork,Meats
174577,326,Polish Sausage Pork,Meats
174578,325,Pork Sausage Link/patty Cooked Pan-Fried,Meats
174579,396,Pork And Beef Sausage Fresh Cooked,Meats
174580,204,Turkey Sausage Reduced Fat Brown And Serve Cooked (Include Butterball Breakfast Links Turkey Sausage),Meats
174581,200,Poultry Salad Sandwich Spread,Meats
174582,378,Dry Pork And Beef Salami,Meats
174583,235,Sandwich Spread Pork Beef,Meats
174584,309,Smoked Link Sausage Pork,Meats
174585,320,Sausage Smoked Link Sausage Pork And Beef,Meats
174586,324,Sausage Italian Pork Cooked,Meats
174587,260,Luncheon Sausage (Pork And Beef),Meats
174588,161,New England Brand Sausage Pork Beef,Meats
174589,316,Oscar Mayer Bologna (Beef),Meats
174590,315,Oscar Mayer Smokies Sausage Little Cheese (Pork Turkey),Meats
174591,329,Oscar Mayer Wieners (Beef Franks),Meats
174592,226,Unprepared Turkey Bacon,Meats
174593,243,Hormel Pillow Pak Sliced Turkey Pepperoni,Meats
174594,196,Luncheon Meat Pork And Chicken Minced Canned Includes Spam Lite,Meats
174595,341,Veal Bratwurst,Meats
174596,305,Liverwurst Spread,Meats
174597,223,Roast Beef Spread,Meats
174598,396,Salami Pork Beef Less Sodium,Meats
174599,426,Sausage Summer Pork And Beef Sticks With Cheddar Cheese,Meats
174600,174,Sausage Turkey Breakfast Links Mild,Meats
174601,307,Swisswurst Pork And Beef With Swiss Cheese Smoked,Meats
174602,517,Bacon And Beef Sticks,Meats
174603,425,Salami,Meats
174604,158,Sausage Italian Turkey Smoked,Meats
174605,216,Sausage Chicken Beef Pork Skinless Smoked,Meats
174606,158,Sausage Turkey Hot Smoked,Meats
174607,226,Kielbasa Polish Turkey And Beef Smoked,Meats
174608,134,Oven-Roasted Chicken Breast Roll,Meats
174609,211,Bologna Pork And Turkey Lite,Meats
174610,336,Bologna Pork Turkey And Beef,Meats
174611,122,Ham Honey Smoked Cooked,Meats
174612,95,Turkey Breast Smoked Lemon Pepper Flavor 97% Fat-Free,Meats
174613,112,Turkey White Rotisserie Deli Cut,Meats
174614,322,Frankfurter Beef Heated,Meats
174615,278,Frankfurter Meat Heated,Meats
174616,327,Beef Sausage Pre-Cooked,Meats
174617,155,Turkey Sausage Fresh Raw,Meats
174618,332,Beef Sausage Fresh Cooked,Meats
174619,389,Malt-O-Meal Coco-Roos,Breakfast Cereals
174620,374,Quaker Quaker Oat Cinnamon Life,Breakfast Cereals
174621,412,Quaker Honey Graham Oh!s,Breakfast Cereals
174622,379,Quaker Oatmeal Squares,Breakfast Cereals
174623,379,Quaker Oatmeal Squares Cinnamon,Breakfast Cereals
174624,379,Quaker Instant Oatmeal Fruit And Cream Variety Dry,Breakfast Cereals
174625,371,Quaker Instant Oatmeal Raisins Dates And Walnuts Dry,Breakfast Cereals
174626,364,Quaker Oat Bran Quaker/mothers Oat Bran Dry,Breakfast Cereals
174627,43,Quaker Oat Bran Quaker/mothers Oat Bran Prepared With Water No Salt,Breakfast Cereals
174628,390,Post Waffle Crisp,Breakfast Cereals
174629,348,Quaker Hominy Grits White Quick Dry,Breakfast Cereals
174630,361,Quaker Hominy Grits White Regular Dry,Breakfast Cereals
174631,401,Malt-O-Meal Colossal Crunch,Breakfast Cereals
174632,382,Quaker Mothers Cinnamon Oat Crunch,Breakfast Cereals
174633,379,Quaker Mothers Graham Bumpers,Breakfast Cereals
174634,382,Quaker Mothers Cocoa Bumpers,Breakfast Cereals
174635,200,Sun Country Kretschmer Toasted Wheat Bran,Breakfast Cereals
174636,369,Quaker Instant Oatmeal Cinnamon-Spice Dry,Breakfast Cereals
174637,384,Quaker Instant Oatmeal Dinosaur Eggs Brown Sugar Dry,Breakfast Cereals
174638,368,Quaker Instant Oatmeal Banana Bread Dry,Breakfast Cereals
174639,346,Uncle Sam Cereal,Breakfast Cereals
174640,371,Quaker Quick Oats With Iron Dry,Breakfast Cereals
174641,333,Quaker Whole Wheat Natural Cereal Dry,Breakfast Cereals
174642,379,Malt-O-Meal Honey Buzzers,Breakfast Cereals
174643,370,Malt-O-Meal Golden Puffs,Breakfast Cereals
174644,388,Moms Best Honey Nut Toasty Os,Breakfast Cereals
174645,390,Malt-O-Meal Apple Zings,Breakfast Cereals
174646,425,Malt-O-Meal Cinnamon Toasters,Breakfast Cereals
174647,397,Malt-O-Meal Cocoa Dyno-Bites,Breakfast Cereals
174648,384,Ralston Corn Flakes,Breakfast Cereals
174649,379,Ralston Crispy Hexagons,Breakfast Cereals
174650,413,Milk And Cereal Bar,Snacks
174651,48,Malt-O-Meal Original Plain Prepared With Water Without Salt,Breakfast Cereals
174652,397,Quaker Christmas Crunch,Breakfast Cereals
174653,413,Post Selects Maple Pecan Crunch,Breakfast Cereals
174654,467,Natures Path Organic Flax Plus Pumpkin Granola,Breakfast Cereals
174655,355,Cream Of Wheat 2 1/2 Minute Cook Time Dry,Breakfast Cereals
174656,379,Incaparina Dry Mix (Corn And Soy Flours) Unprepared,Breakfast Cereals
174657,402,Quaker Capn Crunchs Halloween Crunch,Breakfast Cereals
174658,418,Quaker Natural Granola Apple Cranberry Almond,Breakfast Cereals
174659,373,Quaker Maple Brown Sugar Life Cereal,Breakfast Cereals
174660,367,Quaker Instant Oatmeal Organic Regular,Breakfast Cereals
174661,376,Quaker Instant Oatmeal Fruit And Cream Variety Of Flavors Reduced Sugar,Breakfast Cereals
174662,358,Quaker Instant Oatmeal Apple And Cinnamon Reduced Sugar,Breakfast Cereals
174663,399,Post Honey Bunches Of Oats Pecan Bunches,Breakfast Cereals
174664,392,Malt-O-Meal Chocolate Marshmallow Mateys,Breakfast Cereals
174665,249,Dried Figs,Fruits
174666,107,Figs Dried Stewed,Fruits
174667,32,Fruit Cocktail (Peach And Pineapple And Pear And Grape And Cherry) Canned Water Pack Solids And Liquids,Fruits
174668,46,Fruit Cocktail (Peach And Pineapple And Pear And Grape And Cherry) Canned Juice Pack Solids And Liquids,Fruits
174669,30,Fruit Salad (Peach And Pear And Apricot And Pineapple And Cherry) Canned Water Pack Solids And Liquids,Fruits
174670,50,Fruit Salad (Peach And Pear And Apricot And Pineapple And Cherry) Canned Juice Pack Solids And Liquids,Fruits
174671,58,Fruit Salad (Peach And Pear And Apricot And Pineapple And Cherry) Canned Light Syrup Solids And Liquids,Fruits
174672,88,Fruit Salad (Peach And Pear And Apricot And Pineapple And Cherry) Canned Extra Heavy Syrup Solids And Liquids,Fruits
174673,42,Pink Grapefruit,Fruits
174674,37,California Grapefruit,Fruits
174675,30,Florida Grapefruit,Fruits
174676,33,White Grapefruit,Fruits
174677,37,White California Grapefruit,Fruits
174678,37,Grapefruit Juice White Canned Or Bottled Unsweetened,Fruits
174679,46,Grapefruit Juice White Canned Sweetened,Fruits
174680,146,Grapefruit Juice White Frozen Concentrate Unsweetened Undiluted,Fruits
174681,41,Grapefruit Juice White Frozen Concentrate Unsweetened Diluted With 3 Volume Water,Fruits
174682,67,Grapes,Fruits
174683,69,Red Or Green Grapes (European),Fruits
174684,40,Grapes Canned Thompson Seedless Water Pack Solids And Liquids,Fruits
174685,76,Grapes Canned Thompson Seedless Heavy Syrup Pack Solids And Liquids,Fruits
174686,36,Guava Sauce Cooked,Fruits
174687,95,Jackfruit,Fruits
174688,195,Beef Top Loin Filet Boneless Separable Lean Only Trimmed To 1/8 Inch Fat All Grades Cooked Grilled,Meats
174689,203,Beef Top Loin Filet Boneless Separable Lean Only Trimmed To 1/8 Inch Fat Choice Cooked Grilled,Meats
174690,184,Beef Top Loin Filet Boneless Separable Lean Only Trimmed To 1/8 Inch Fat Select Cooked Grilled,Meats
174691,149,Beef Top Loin Petite Roast/filet Boneless Separable Lean Only Trimmed To 1/8 Inch Fat Choice Raw,Meats
174692,135,Beef Top Loin Petite Roast/filet Boneless Separable Lean Only Trimmed To 1/8 Inch Fat Select Raw,Meats
174693,171,Beef Loin Top Sirloin Filet Boneless Separable Lean Only Trimmed To 0 Inch Fat All Grades Cooked Grilled,Meats
174694,174,Beef Loin Top Sirloin Filet Boneless Separable Lean Only Trimmed To 0 Inch Fat Choice Cooked Grilled,Meats
174695,122,Beef Loin Top Sirloin Petite Roast/filet Boneless Separable Lean Only Trimmed To 0 Inch Fat Select Raw,Meats
174696,133,Beef Ribeye  Petite Roast/filet Boneless Separable Lean Only Trimmed To 0 Inch Fat All Grades Raw,Meats
174697,138,Beef Ribeye  Petite Roast/filet Boneless Separable Lean Only Trimmed To 0 Inch Fat Choice Raw,Meats
174698,125,Beef Ribeye  Petite Roast/filet Boneless Separable Lean Only Trimmed To 0 Inch Fat Select Raw,Meats
174699,187,Beef Ribeye Cap Steak Boneless Separable Lean Only Trimmed To 0 Inch Fat Choice Raw,Meats
174700,169,Beef Ribeye Cap Steak Boneless Separable Lean Only Trimmed To 0 Inch Fat Select Raw,Meats
174701,199,Beef Ribeye Filet Boneless Separable Lean Only Trimmed To 0 Inch Fat All Grades Cooked Grilled,Meats
174702,208,Beef Ribeye Filet Boneless Separable Lean Only Trimmed To 0 Inch Fat Choice Cooked Grilled,Meats
174703,186,Ribeye Steak (Filet),Meats
174704,238,Beef Loin Top Sirloin Cap Steak Boneless Separable Lean And Fat Trimmed To 1/8 Inch Fat Choice Cooked Grilled,Meats
174705,249,Beef Loin Top Sirloin Cap Steak Boneless Separable Lean And Fat Trimmed To 1/8 Inch Fat Select Cooked Grilled,Meats
174706,191,Beef Loin Top Sirloin Cap Steak Boneless Separable Lean And Fat Trimmed To 1/8 Inch Fat All Grades Raw,Meats
174707,199,Beef Loin Top Sirloin Cap Steak Boneless Separable Lean And Fat Trimmed To 1/8 Inch Fat Choice Raw,Meats
174708,228,Beef Top Loin Petite Roast Boneless Separable Lean And Fat Trimmed To 1/8 Inch Fat All Grades Cooked Roasted,Meats
174709,239,Beef Top Loin Petite Roast Boneless Separable Lean And Fat Trimmed To 1/8 Inch Fat Choice Cooked Roasted,Meats
174710,213,Beef Top Loin Petite Roast Boneless Separable Lean And Fat Trimmed To 1/8 Inch Fat Select Cooked Roasted,Meats
174711,187,Beef Top Loin Petite Roast/filet Boneless Separable Lean And Fat Trimmed To 1/8 Inch Fat All Grades Raw,Meats
174712,275,Beef Loin Top Loin Steak Boneless Lip-On Separable Lean And Fat Trimmed To 1/8 Inch Fat Choice Cooked Grilled,Meats
174713,247,Beef Loin Top Loin Steak Boneless Lip-On Separable Lean And Fat Trimmed To 1/8 Inch Fat Select Cooked Grilled,Meats
174714,264,Beef Loin Top Loin Steak Boneless Lip-On Separable Lean And Fat Trimmed To 1/8 Inch Fat All Grades Cooked Grilled,Meats
174715,193,Beef New Zealand Imported Bolar Blade Separable Lean Only Cooked Fast Roasted,Meats
174716,129,Beef New Zealand Imported Bolar Blade Separable Lean Only Raw,Meats
174717,265,Beef New Zealand Imported Brisket Navel End Separable Lean Only Cooked Braised,Meats
174718,194,Beef New Zealand Imported Brisket Navel End Separable Lean Only Raw,Meats
174719,239,Beef New Zealand Imported Cube Roll Separable Lean Only Cooked Fast Roasted,Meats
174720,161,Beef New Zealand Imported Cube Roll Separable Lean Only Raw,Meats
174721,164,Beef New Zealand Imported Eye Round Separable Lean Only Cooked Slow Roasted,Meats
174722,116,Beef New Zealand Imported Eye Round Separable Lean Only Raw,Meats
174723,105,Beef New Zealand Imported Variety Meats And By-Products Heart Raw,Meats
174724,167,Beef New Zealand Imported Hind Shin Separable Lean Only Cooked Braised,Meats
174725,114,Beef New Zealand Imported Hind Shin Separable Lean Only Raw,Meats
174726,128,Beef New Zealand Imported Inside Raw,Meats
174727,87,Beef New Zealand Imported Variety Meats And By-Products Kidney Raw,Meats
174728,150,Beef New Zealand Imported Variety Meats And By-Products Liver Cooked Boiled,Meats
174729,133,Beef New Zealand Imported Variety Meats And By-Products Liver Raw,Meats
174730,126,Beef New Zealand Imported Manufacturing Beef Cooked Boiled,Meats
174731,146,Beef New Zealand Imported Ribs Prepared Raw,Meats
174732,188,Beef New Zealand Imported Rump Centre Separable Lean Only Cooked Fast Fried,Meats
174733,217,Beef New Zealand Imported Striploin Separable Lean Only Cooked Fast Fried,Meats
174734,150,Beef New Zealand Imported Striploin Separable Lean Only Raw,Meats
174735,178,Beef New Zealand Imported Oyster Blade Separable Lean And Fat Raw,Meats
174736,140,Beef New Zealand Imported Tenderloin Separable Lean Only Raw,Meats
174737,271,Beef New Zealand Imported Variety Meats And By-Products Tongue Cooked Boiled,Meats
174738,243,Beef New Zealand Imported Variety Meats And By-Products Tongue Raw,Meats
174739,453,Beef New Zealand Imported Brisket Navel End Separable Lean And Fat Cooked Braised,Meats
174740,345,Beef New Zealand Imported Brisket Navel End Separable Lean And Fat Raw,Meats
174741,250,Beef New Zealand Imported Brisket Point End Separable Lean And Fat Cooked Braised,Meats
174742,163,Beef New Zealand Imported Brisket Point End Separable Lean And Fat Raw,Meats
174743,168,Beef New Zealand Imported Eye Round Separable Lean And Fat Cooked Slow Roasted,Meats
174744,129,Beef New Zealand Imported Eye Round Separable Lean And Fat Raw,Meats
174745,208,Beef New Zealand Imported Flank Separable Lean And Fat Cooked Braised,Meats
174746,161,Beef New Zealand Imported Flank Separable Lean And Fat Raw,Meats
174747,252,Beef New Zealand Imported Flat Separable Lean And Fat Cooked Braised,Meats
174748,192,Beef New Zealand Imported Rump Centre Separable Lean And Fat Cooked Fast Fried,Meats
174749,141,Beef New Zealand Imported Rump Centre Separable Lean Only Raw,Meats
174750,145,Beef New Zealand Imported Rump Centre Separable Lean And Fat Raw,Meats
174751,301,Beef New Zealand Imported Striploin Separable Lean And Fat Cooked Fast Fried,Meats
174752,193,Broiled Ground Beef Patty (93% Lean),Meats
174753,182,Beef Ground 93% Lean Meat /7% Fat Patty Cooked Pan-Broiled,Meats
174754,192,Beef Ground 93% Lean Meat / 7% Fat Loaf Cooked Baked,Meats
174755,209,Beef Ground 93% Lean Meat / 7% Fat Crumbles Cooked Pan-Browned,Meats
174756,175,Beef Ground 97% Lean Meat / 3% Fat Crumbles Cooked Pan-Browned,Meats
174757,167,Beef Composite Of Trimmed Retail Cuts Separable Lean And Fat Trimmed To 0 Inch Fat All Grades Raw,Meats
174758,140,Beef Composite Of Trimmed Retail Cuts Separable Lean Only Trimmed To 1/8 Inch Fat All Grades Raw,Meats
174759,194,Beef Composite Of Trimmed Retail Cuts Separable Lean Only Trimmed To 1/8 Inch Fat All Grades Cooked,Meats
174760,138,Beef Composite Of Trimmed Retail Cuts Separable Lean Only Trimmed To 0 Inch Fat All Grades Raw,Meats
174761,148,Beef Rib Small End (Ribs 10-12) Separable Lean Only Trimmed To 1/8 Inch Fat Choice Raw,Meats
174762,158,Beef Tenderloin Steak Separable Lean Only Trimmed To 1/8 Inch Fat Choice Raw,Meats
174763,135,Beef Top Sirloin Steak Separable Lean Only Trimmed To 1/8 Inch Fat Choice Raw,Meats
174764,202,Beef Rib Small End (Ribs 10-12) Separable Lean Only Trimmed To 1/8 Inchfat Choice Cooked Broiled,Meats
174765,125,Beef Chuck Arm Pot Roast Separable Lean Only Trimmed To 1/8 Inch Fat Select Raw,Meats
174766,124,Beef Brisket Flat Half Separable Lean Only Trimmed To 1/8 Inch Fat Select Raw,Meats
174767,205,Beef Chuck Arm Pot Roast Separable Lean Only Trimmed To 1/8 Inch Fat Select Cooked Braised,Meats
174768,189,Beef Brisket Flat Half Separable Lean Only Trimmed To 1/8 Inch Fat Select Cooked Braised,Meats
174769,94,Beef Variety Meats And By-Products Tripe Cooked Simmered,Meats
174770,142,Beef Bottom Sirloin Tri-Tip Roast Separable Lean Only Trimmed To 0 Inch Fat All Grades Raw,Meats
174771,193,Beef Bottom Sirloin Tri-Tip Roast Separable Lean Only Trimmed To 0 Inch Fat Choice Cooked Roasted,Meats
174772,154,Beef Bottom Sirloin Tri-Tip Roast Separable Lean Only Trimmed To 0 Inch Fat Choice Raw,Meats
174773,179,Beef Bottom Sirloin Tri-Tip Roast Separable Lean Only Trimmed To 0 Inch Fat Select Cooked Roasted,Meats
174774,186,Beef Flank Steak Separable Lean Only Trimmed To 0 Inch Fat All Grades Cooked Broiled,Meats
174775,178,Beef Flank Steak Separable Lean Only Trimmed To 0 Inch Fat Select Cooked Broiled,Meats
174776,141,Beef Flank Steak Separable Lean Only Trimmed To 0 Inch Fat All Grades Raw,Meats
174777,137,Beef Flank Steak Separable Lean Only Trimmed To 0 Inch Fat Select Raw,Meats
174778,424,Snacks Popcorn Microwave Low Fat,Snacks
174779,359,Snacks Candy Rolls Yogurt-Covered Fruit Flavored With High Vitamin C,Snacks
174780,396,Formulated Bar Mars Snackfood Us Snickers Marathon Chewy Chocolate Peanut Bar,Snacks
174781,422,Formulated Bar Mars Snackfood Us Snickers Marathon Multigrain Crunch Bar,Snacks
174782,347,Formulated Bar Mars Snackfood Us Cocoavia Chocolate Almond Snack Bar,Snacks
174783,532,Snacks Sweet Potato Chips Unsalted,Snacks
174784,491,Snacks Fritolay Sunchips Multigrain Snack Original Flavor,Snacks
174785,557,Snacks Popcorn Microwave Regular (Butter) Flavor Made With Partially Hydrogenated Oil,Snacks
174786,415,Formulated Bar Mars Snackfood Us Snickers Marathon Protein Performance Bar Caramel Nut Rush,Snacks
174787,403,Formulated Bar Luna Bar Nutz Over Chocolate,Snacks
174788,496,Snacks Fritolay Sunchips Multigrain French Onion Flavor,Snacks
174789,491,Snacks Fritolay Sunchips Multigrain Snack Harvest Cheddar Flavor,Snacks
174790,345,Soft Pretzels,Snacks
174791,517,Snacks Vegetable Chips Hain Celestial Group Terra Chips,Snacks
174792,426,Formulated Bar Zone Perfect Classic Crunch Bar Mixed Flavors,Snacks
174793,390,Snacks Granola Bar Kashi Golean Chewy Mixed Flavors,Snacks
174794,429,Snacks Granola Bar Kashi Tlc Bar Chewy Mixed Flavors,Snacks
174795,389,Snacks Granola Bars Quaker Oatmeal To Go All Flavors,Snacks
174796,473,Snacks Vegetable Chips Made From Garden Vegetables,Snacks
174797,446,Snacks Granola Bar Kashi Tlc Bar Crunchy Mixed Flavors,Snacks
174798,415,Snacks Candy Bits Yogurt Covered With Vitamin C,Snacks
174799,346,Snacks Clif Bar Mixed Flavors,Snacks
174800,408,Snacks Granola Bar Quaker Chewy 90 Calorie Bar,Snacks
174801,487,Snacks Granola Bar General Mills Nature Valley Sweet&salty Nut Peanut,Snacks
174802,423,Snacks Granola Bar General Mills Nature Valley With Yogurt Coating,Snacks
174803,383,Snack Mixed Berry Bar,Snacks
174804,505,Snacks Potato Chips Made From Dried Potatoes (Preformed) Multigrain,Snacks
174805,560,Snacks Potato Chips Lightly Salted,Snacks
174806,389,Snacks Pretzels Gluten- Free Made With Cornstarch And Potato Flour,Snacks
174807,27,Soup Egg Drop Chinese Restaurant,Soups and Sauces
174808,39,Soup Hot And Sour Chinese Restaurant,Soups and Sauces
174809,4,The Coca-Cola Company Nos Zero Energy Drink Sugar-Free With Guarana Fortified With Vitamins B6 And B12,Beverages
174810,119,Alcoholic Beverage Whiskey Sour Canned,Beverages
174811,87,Whiskey Sour Mix Bottled,Beverages
174812,153,Alcoholic Beverage Whiskey Sour Prepared From Item 14028,Beverages
174813,405,Abbott Eas Soy Protein Powder,Beverages
174814,52,Cytosport Muscle Milk Ready-To-Drink,Beverages
174815,231,Alcoholic Beverage Distilled All (Gin Rum Vodka Whiskey) 80 Proof,Beverages
174816,15,Ocean Spray Cran-Energy Cranberry Energy Juice Drink,Beverages
174817,231,Rum,Beverages
174818,231,Vodka,Beverages
174819,250,Whiskey,Beverages
174820,50,Chocolate Almond Milk,Beverages
174821,62,Energy Drink,Beverages
174822,4,Energy Drink Sugar Free,Beverages
174823,105,Abbott Ensure Nutritional Shake Ready-To-Drink,Beverages
174824,350,Chocolate Drink Powder,Beverages
174825,0,Zevia Cola,Beverages
174826,0,Zevia Cola Caffeine Free,Beverages
174827,0,Gerolsteiner Brunnen Gmbh & Co. Kggerolsteiner Naturally Sparkling Mineral Water,Beverages
174828,49,Yellow Green Colored Citrus Soft Drink With Caffeine,Beverages
174829,37,V8 Splash Smoothies Strawberry Banana,Beverages
174830,41,V8 Splash Smoothies Tropical Colada,Beverages
174831,18,Coconut Water Ready-To-Drink Unsweetened,Beverages
174832,15,Unsweetened Almond Milk,Beverages
174833,83,Cabernet Sauvignon,Beverages
174834,83,Cabernet Franc,Beverages
174835,82,Pinot Noir,Beverages
174836,83,Syrah,Beverages
174837,82,White Wine,Beverages
174838,80,Lemberger,Beverages
174839,86,Sangiovese,Beverages
174840,74,Carignane,Beverages
174841,83,Pinot Gris (Grigio),Beverages
174842,0,Club Soda,Beverages
174843,81,Gewurztraminer,Beverages
174844,108,Gewurztraminer (Late Harvest),Beverages
174845,82,Semillon,Beverages
174846,34,Ginger Ale,Beverages
174847,36,Nestea,Beverages
174848,81,Pinot Blanc,Beverages
174849,82,Muscat Wine,Beverages
174850,1,Diet Pepper Cola,Beverages
174851,41,Caffeine Free Cola,Beverages
174852,42,Cola Soft Drink,Beverages
174853,20,Diet Cola,Beverages
174854,48,Orange Soda,Beverages
174855,1,Tea Black Ready-To-Drink Peach Diet,Beverages
174856,45,Ocean Spray Ruby Red Cranberry,Beverages
174857,22,Motts Apple Juice Light Fortified With Vitamin C,Beverages
174858,376,Lemonade Powder,Beverages
174859,14,Lemonade Powder Prepared With Water,Beverages
174860,380,Lemonade-Flavor Drink Powder,Beverages
174861,27,Lemonade-Flavor Drink Powder Prepared With Water,Beverages
174862,52,Limeade Frozen Concentrate Prepared With Water,Beverages
174863,37,Malt Beverage Includes Non-Alcoholic Beer,Beverages
174864,372,Ovaltine Classic Malt Powder,Beverages
174865,87,Malted Drink Mix Chocolate With Added Nutrients Powder Prepared With Whole Milk,Beverages
174866,411,Malted Drink Mix Chocolate Powder,Beverages
174867,85,Malted Drink Mix Chocolate Powder Prepared With Whole Milk,Beverages
174868,49,Orange Drink Canned With Added Vitamin C,Beverages
174869,389,Strawberry-Flavor Beverage Mix Powder,Beverages
174870,88,Strawberry-Flavor Beverage Mix Powder Prepared With Whole Milk,Beverages
174871,1,Tea Black Brewed Prepared With Tap Water Decaffeinated,Beverages
174872,315,Tea Instant Decaffeinated Unsweetened,Beverages
174873,1,Tea Instant Unsweetened Prepared With Water,Beverages
174874,322,Lamb New Zealand Imported Square-Cut Shoulder Chops Separable Lean And Fat Cooked Braised,Meats
174875,275,Lamb New Zealand Imported Square-Cut Shoulder Chops Separable Lean And Fat Raw,Meats
174876,294,Lamb New Zealand Imported Square-Cut Shoulder Separable Lean And Fat Cooked Slow Roasted,Meats
174877,121,Lamb New Zealand Imported Tunnel-Boned Leg Chump Off Shank Off Separable Lean And Fat Raw,Meats
174878,120,Lamb New Zealand Imported Tenderloin Separable Lean And Fat Raw,Meats
174879,215,Veal Ground Cooked Pan-Fried,Meats
174880,151,Veal Leg Top Round Cap Off Cutlet Boneless Cooked Grilled,Meats
174881,159,Veal Shoulder Blade Chop Separable Lean Only Cooked Grilled,Meats
174882,503,Veal External Fat Only Raw,Meats
174883,540,Veal External Fat Only Cooked,Meats
174884,444,Veal Seam Fat Only Raw,Meats
174885,190,Lamb Australian Imported Fresh Leg Bottom Boneless Separable Lean Only Trimmed To 1/8 Inch Fat Cooked Roasted,Meats
174886,174,Lamb Australian Imported Fresh Leg Hindshank Heel On Bone-In Separable Lean Only Trimmed To 1/8 Inch Fat Cooked Braised,Meats
174887,122,Lamb Australian Imported Fresh Leg Hindshank Heel On Bone-In Separable Lean Only Trimmed To 1/8 Inch Fat Raw,Meats
174888,184,Lamb Australian Imported Fresh Tenderloin Boneless Separable Lean Only Trimmed To 1/8 Inch Fat Cooked Roasted,Meats
174889,175,Lamb Australian Imported Fresh Rack Roast Frenched Denuded Bone-In Separable Lean Only Trimmed To 0 Inch Fat Cooked Roasted,Meats
