ID,Calories,name,Food Group
171289,307,Cheese Product Pasteurized Process American Vitamin D Fortified,Dairy and Egg Products
171290,371,Cheese Pasteurized Process American Without Added Vitamin D,Dairy and Egg Products
171291,330,Cheese Food Pasteurized Process American Without Added Vitamin D,Dairy and Egg Products
171292,316,Cheese Cheddar Reduced Fat,Dairy and Egg Products
171293,141,Ice Cream Light Soft Serve Chocolate,Dairy and Egg Products
171294,358,Ice Cream Bar Stick Or Nugget With Crunch Coating,Dairy and Egg Products
171295,157,Cheddar Cheese (Non-Fat Or Fat Free),Dairy and Egg Products
171296,71,Yogurt Greek Nonfat Vanilla Chobani,Dairy and Egg Products
171297,106,Yogurt Greek Strawberry Dannon Oikos,Dairy and Egg Products
171298,85,Yogurt Greek Nonfat Vanilla Dannon Oikos,Dairy and Egg Products
171299,84,Nonfat Strawberry Yogurt,Dairy and Egg Products
171300,105,Lowfat Greek Strawberry Yogurt,Dairy and Egg Products
171301,62,Kefir Lowfat Strawberry Lifeway,Dairy and Egg Products
171302,107,Milk Evaporated 2% Fat With Added Vitamin A And Vitamin D,Dairy and Egg Products
171303,67,Fatfree Chocolate Milk,Dairy and Egg Products
171304,97,Greek Yogurt (Plain),Dairy and Egg Products
171305,303,Ice Cream Bar Covered With Chocolate And Nuts,Dairy and Egg Products
171306,254,Ice Cream Sundae Cone,Dairy and Egg Products
171307,165,Light Ice Cream Creamsicle,Dairy and Egg Products
171308,72,Cream Half And Half Lowfat,Dairy and Egg Products
171309,82,Yogurt Greek Whole Plain Chobani,NULL
171310,78,Yogurt Greek Nonfat Lemon Blend Chobani,NULL
171311,80,Yogurt Greek Nonfat Peach Chobani,NULL
171312,54,Yogurt Greek Nonfat Plain Chobani,NULL
171313,81,Yogurt Greek Nonfat Raspberry Chobani,NULL
171314,900,Butter Clarified Butter (Ghee),NULL
171315,263,Ground Allspice,Spices and Herbs
171316,337,Anise Seeds,Spices and Herbs
171317,233,Dried Basil,Spices and Herbs
171318,237,Dried Chervil,Spices and Herbs
171319,282,Chili Powder,Spices and Herbs
171320,247,Cinnamon,Spices and Herbs
171321,274,Ground Cloves,Spices and Herbs
171322,253,Dried Dill Weed,Spices and Herbs
171323,345,Fennel Seed,Spices and Herbs
171324,323,Fenugreek Seed,Spices and Herbs
171325,331,Garlic Powder,Spices and Herbs
171326,525,Ground Nutmeg,Spices and Herbs
171327,341,Onion Powder,Spices and Herbs
171328,265,Dried Oregano,Spices and Herbs
171329,282,Paprika,Spices and Herbs
171330,525,Poppy Seeds,Spices and Herbs
171331,307,Poultry Seasoning,Spices and Herbs
171332,342,Pumpkin Pie Spice,Spices and Herbs
171333,331,Dried Rosemary,Spices and Herbs
171334,65,Babyfood Vegetables Corn Creamed Junior,Baby Foods
171335,56,Babyfood Fruit Bananas With Tapioca Strained,Baby Foods
171336,65,Babyfood Fruit Peaches Strained,Baby Foods
171337,65,Babyfood Fruit Peaches Junior,Baby Foods
171338,42,Babyfood Fruit Pears Strained,Baby Foods
171339,70,Babyfood Fruit Prunes With Tapioca Without Ascorbic Acid Junior,Baby Foods
171340,100,Babyfood Prunes Without Vitamin C Strained,Baby Foods
171341,70,Babyfood Fruit Dessert Mango With Tapioca,Baby Foods
171342,57,Babyfood Pears Dices Toddler,Baby Foods
171343,37,Babyfood Fruit Applesauce And Pineapple Strained,Baby Foods
171344,39,Babyfood Fruit Applesauce And Pineapple Junior,Baby Foods
171345,58,Babyfood Fruit Apple And Raspberry Strained,Baby Foods
171346,58,Babyfood Fruit Apple And Raspberry Junior,Baby Foods
171347,44,Babyfood Fruit Pears And Pineapple Junior,Baby Foods
171348,63,Babyfood Fruit Guava And Papaya With Tapioca Strained,Baby Foods
171349,51,Babyfood Peaches Dices Toddler,Baby Foods
171350,70,Babyfood Fruit Papaya And Applesauce With Tapioca Strained,Baby Foods
171351,51,Babyfood Apple-Banana Juice,Baby Foods
171352,43,Babyfood Juice Apple And Peach,Baby Foods
171353,72,Babyfood Juice Apple And Prune,Baby Foods
171354,45,Babyfood Juice Orange,Baby Foods
171355,43,Babyfood Juice Orange And Apple,Baby Foods
171356,70,Babyfood Juice Prune And Orange,Baby Foods
171357,47,Babyfood Juice Mixed Fruit,Baby Foods
171358,376,Babyfood Cereal Barley Dry Fortified,Baby Foods
171359,402,Babyfood Cereal Whole Wheat With Apples Dry Fortified,Baby Foods
171360,394,Babyfood Cereal Oatmeal Dry Fortified,Baby Foods
171361,399,Babyfood Cereal Oatmeal With Bananas Dry,Baby Foods
171362,75,Babyfood Cereal Oatmeal With Applesauce And Bananas Strained,Baby Foods
171363,76,Babyfood Cereal Oatmeal With Applesauce And Bananas Junior,Baby Foods
171364,52,Babyfood Cereal With Egg Yolks Junior,Baby Foods
171365,58,Babyfood Cereal With Eggs Strained,Baby Foods
171366,79,Babyfood Cereal Egg Yolks And Bacon Junior,Baby Foods
171367,402,Babyfood Oatmeal Cereal With Fruit Dry Instant Toddler Fortified,Baby Foods
171368,435,Babyfood Cookie Baby Fruit,Baby Foods
171369,424,Babyfood Cookies Arrowroot,Baby Foods
171370,397,Babyfood Pretzels,Baby Foods
171371,407,Babyfood Teething Biscuits,Baby Foods
171372,426,Zwieback,Baby Foods
171373,69,Babyfood Dessert Cherry Vanilla Pudding Junior,Baby Foods
171374,80,Babyfood Dessert Fruit Pudding Orange Strained,Baby Foods
171375,65,Babyfood Dessert Peach Cobbler Strained,Baby Foods
171376,67,Babyfood Dessert Peach Cobbler Junior,Baby Foods
171377,63,Babyfood Dessert Fruit Dessert Without Ascorbic Acid Junior,Baby Foods
171378,60,Babyfood Dessert Tropical Fruit Junior,Baby Foods
171379,85,Babyfood Dessert Custard Pudding Vanilla Strained,Baby Foods
171380,86,Babyfood Dessert Custard Pudding Vanilla Junior,Baby Foods
171381,46,Babyfood Juice Apple And Grape,Baby Foods
171382,128,Infant Formula Abbott Nutrition Similac Isomil Advance With Iron Liquid Concentrate,Baby Foods
171383,66,Infant Formula Abbott Nutrition Similac Isomil Advance With Iron Ready-To-Feed,Baby Foods
171384,517,Infant Formula Abbott Nutrition Similac Isomil Advance With Iron Powder Not Reconstituted,Baby Foods
171385,66,Infant Formula Nestle Good Start Supreme With Iron Dha And Ara Ready-To-Feed,Baby Foods
171386,66,Infant Formula Nestle Good Start Supreme With Iron Dha And Ara Prepared From Liquid Concentrate,Baby Foods
171387,68,Infant Formula Mead Johnson Enfamil Gentlease Lipil With Iron Prepared From Powder,Baby Foods
171388,344,Babyfood Fortified Cereal Bar Fruit Filling,Baby Foods
171389,516,Infant Formula Mead Johnson Enfamil Gentlease Powder,Baby Foods
171390,65,Infant Formula Mead Johnson Enfamil Enfagrow Soy Toddler Ready-To-Feed,Baby Foods
171391,66,Infant Formula Mead Johnson Enfamil Nutramigen Aa Ready-To-Feed,Baby Foods
171392,63,Infant Formula Mead Johnson Enfamil Premature 20 Calories Ready-To-Feed,Baby Foods
171393,81,Infant Formula Mead Johnson Enfamil Premature 24 Calo Ready-To-Feed,Baby Foods
171394,66,Infant Formula Gerber Good Start 2 Protect Plus Ready-To-Feed,Baby Foods
171395,66,Infant Formula Abbott Nutrition Similac Go And Grow Ready-To-Feed With Ara And Dha,Baby Foods
171396,66,Infant Formula Abbott Nutrition Similac Expert Care Diarrhea Ready- To- Feed With Ara And Dha,Baby Foods
171397,66,Infant Formula Abbott Nutrition Similac For Spit Up Ready-To-Feed With Ara And Dha,Baby Foods
171398,503,Babyfood Snack Gerber Graduates Lil Crunchies Baked Whole Grain Corn Snack,Baby Foods
171399,514,Infant Formula Abbott Nutrition Similac For Spit Up Powder With Ara And Dha,Baby Foods
171400,902,Beef Tallow,Fats and Oils
171401,902,Lard,Fats and Oils
171402,379,Thousand Island,Fats and Oils
171403,250,Mayonnaise Salad Dressing,Fats and Oils
171404,222,Salad Dressing French Dressing Reduced Fat,Fats and Oils
171405,102,Italian Salad Dressing,Fats and Oils
171406,232,Salad Dressing Mayonnaise Imitation Soybean,Fats and Oils
171407,97,Salad Dressing Mayonnaise Imitation Milk Cream,Fats and Oils
171408,482,Salad Dressing Mayonnaise Imitation Soybean Without Cholesterol,Fats and Oils
171409,389,Sandwich Spread With Chopped Pickle Regular Unspecified Oils,Fats and Oils
171410,884,Peanut Oil,Fats and Oils
171411,884,Soybean Oil,Fats and Oils
171412,892,Coconut Oil,Fats and Oils
171413,884,Olive Oil,Fats and Oils
171414,419,Salad Dressing French Dressing Commercial Regular,Fats and Oils
171415,349,Margarine-Like Vegetable Oil Spread Unspecified Oils Approximately 37% Fat With Salt,Fats and Oils
171416,631,Salad Dressing French Home Recipe,Fats and Oils
171417,449,Salad Dressing Home Recipe Vinegar And Oil,Fats and Oils
171418,717,Salad Dressing Mayonnaise Soybean Oil Without Salt,Fats and Oils
171419,631,Salad Dressing French Cottonseed Oil Home Recipe,Fats and Oils
171420,132,Salad Dressing French Dressing Fat-Free,Fats and Oils
171421,884,Cocoa Butter,Fats and Oils
171422,862,Palm Kernel Oil,Fats and Oils
171423,884,Poppyseed Oil,Fats and Oils
171424,884,Tomatoseed Oil,Fats and Oils
171425,884,Teaseed Oil,Fats and Oils
171426,763,Soybean Lecithin,Fats and Oils
171427,884,Hazelnut Oil,Fats and Oils
171428,884,Oil Babassu,Fats and Oils
171429,884,Oil Sheanut,Fats and Oils
171430,792,Oil Pam Cooking Spray Original,Fats and Oils
171431,606,Margarine Margarine-Like Vegetable Oil Spread 67-70% Fat Tub,Fats and Oils
171432,730,Margarine 80% Fat Tub Canola Harvest Soft Spread (Canola Palm And Palm Kernel Oils),Fats and Oils
171433,884,Oil Cooking And Salad Enova 80% Diglycerides,Fats and Oils
171434,339,Margarine-Like Vegetable Oil Spread Approximately 37% Fat Unspecified Oils With Salt With Added Vitamin D,Fats and Oils
171435,717,Margarine Regular 80% Fat Composite Stick With Salt With Added Vitamin D,Fats and Oils
171436,713,Margarine Regular 80% Fat Composite Tub With Salt With Added Vitamin D,Fats and Oils
171437,537,Margarine-Like Vegetable Oil Spread 60% Fat Stick With Salt With Added Vitamin D,Fats and Oils
171438,900,Oil Industrial Soy Low Linolenic,Fats and Oils
171439,884,Oil Industrial Soy Ultra Low Linolenic,Fats and Oils
171440,884,Oil Industrial Soy Fully Hydrogenated,Fats and Oils
171441,884,Oil Industrial Cottonseed Fully Hydrogenated,Fats and Oils
171442,878,Oil Flaxseed Contains Added Sliced Flaxseed,Fats and Oils
171443,361,Mayonnaise Reduced Fat With Olive Oil,Fats and Oils
171444,158,Salad Dressing Mayonnaise-Type Light,Fats and Oils
171445,144,Chicken Broiler Rotisserie BBQ Breast Meat Only,Meats
171446,216,Chicken Broilers Or Fryers Meat And Skin And Giblets And Neck Stewed,Meats
171447,215,Chicken Broilers Or Fryers Meat And Skin Raw,Meats
171448,289,Chicken Broilers Or Fryers Meat And Skin Cooked Fried Batter,Meats
171449,269,Chicken Broilers Or Fryers Meat And Skin Cooked Fried Flour,Meats
171450,239,Chicken Broilers Or Fryers Meat And Skin Cooked Roasted,Meats
171451,177,Chicken Broilers Or Fryers Meat Only Stewed,Meats
171452,349,Chicken Broilers Or Fryers Skin Only Raw,Meats
171453,394,Chicken Broilers Or Fryers Skin Only Cooked Fried Batter,Meats
171454,502,Chicken Broilers Or Fryers Skin Only Cooked Fried Flour,Meats
171455,157,Chicken Broilers Or Fryers Giblets Cooked Simmered,Meats
171456,94,Chicken Gizzard All Classes Raw,Meats
171457,154,Chicken Gizzard All Classes Cooked Simmered,Meats
171458,153,Chicken Heart All Classes Raw,Meats
171459,277,Chicken Broilers Or Fryers Light Meat Meat And Skin Cooked Fried Batter,Meats
171460,246,Chicken Broilers Or Fryers Light Meat Meat And Skin Cooked Fried Flour,Meats
171461,222,Chicken Broilers Or Fryers Light Meat Meat And Skin Cooked Roasted,Meats
171462,201,Chicken Broilers Or Fryers Light Meat Meat And Skin Cooked Stewed,Meats
171463,237,Chicken Broilers Or Fryers Dark Meat Meat And Skin Raw,Meats
171464,114,Chicken Broilers Or Fryers Light Meat Meat Only Raw,Meats
171465,192,Chicken Broilers Or Fryers Light Meat Meat Only Cooked Fried,Meats
171466,173,Chicken Broilers Or Fryers Light Meat Meat Only Cooked Roasted,Meats
171467,159,Chicken Broilers Or Fryers Light Meat Meat Only Cooked Stewed,Meats
171468,629,Chicken Broilers Or Fryers Separable Fat Raw,Meats
171469,319,Chicken Broilers Or Fryers Back Meat And Skin Raw,Meats
171470,331,Chicken Broilers Or Fryers Back Meat And Skin Cooked Fried Batter,Meats
171471,331,Chicken Broilers Or Fryers Back Meat And Skin Cooked Fried Flour,Meats
171472,239,Chicken Broilers Or Fryers Back Meat Only Cooked Roasted,Meats
171473,209,Chicken Broilers Or Fryers Back Meat Only Cooked Stewed,Meats
171474,172,Chicken Broilers Or Fryers Breast Meat And Skin Raw,Meats
171475,260,Chicken Broilers Or Fryers Breast Meat And Skin Cooked Fried Batter,Meats
171476,222,Chicken Broilers Or Fryers Breast Meat And Skin Cooked Fried Flour,Meats
171477,165,Roasted Chicken Breast,Meats
171478,151,Chicken Broilers Or Fryers Breast Meat Only Cooked Stewed,Meats
171479,189,Roasted Turkey,Meats
171480,115,Turkey Whole Meat Only Raw,Meats
171481,159,Roast Turkey (Without Skin),Meats
171482,407,Turkey Skin From Whole (Light And Dark) Raw,Meats
171483,155,Turkey Gizzard All Classes Cooked Simmered,Meats
171484,140,Turkey Heart All Classes Raw,Meats
171485,174,Turkey Heart All Classes Cooked Simmered,Meats
171486,128,Turkey Liver All Classes Raw,Meats
171487,189,Turkey Liver All Classes Cooked Simmered,Meats
171488,166,Turkey Dark Meat Meat And Skin Raw,Meats
171489,206,Turkey Dark Meat From Whole Meat And Skin Cooked Roasted,Meats
171490,114,Turkey From Whole Light Meat Raw,Meats
171491,147,Roasted Turkey Light Meat,Meats
171492,189,Turkey All Classes Breast Meat And Skin Cooked Roasted,Meats
171493,144,Turkey All Classes Leg Meat And Skin Raw,Meats
171494,208,Turkey All Classes Leg Meat And Skin Cooked Roasted,Meats
171495,197,Turkey All Classes Wing Meat And Skin Raw,Meats
171496,147,Roasted Turkey Breast,Meats
171497,115,Turkey Wing From Whole Bird Meat Only Raw,Meats
171498,147,Turkey Wing From Whole Bird Meat Only Roasted,Meats
171499,482,Turkey Young Hen Skin Only Cooked Roasted,Meats
171500,67,Turkey And Gravy Frozen,Meats
171501,126,Turkey Breast Pre-Basted Meat And Skin Cooked Roasted,Meats
171502,157,Turkey Thigh Pre-Basted Meat And Skin Cooked Roasted,Meats
171503,120,Turkey Roast Boneless Frozen Seasoned Light And Dark Meat Raw,Meats
171504,201,Turkey Mechanically Deboned From Turkey Frames Raw,Meats
171505,148,Ground Turkey Raw,Meats
171506,203,Ground Turkey Cooked,Meats
171507,200,Chicken Cornish Game Hens Meat And Skin Raw,Meats
171508,248,Chicken Wing Frozen Glazed Barbecue Flavored Heated (Microwave),Meats
171509,108,Chicken Broilers Or Fryers Breast Skinless Boneless Meat Only With Added Solution Raw,Meats
171510,202,Duck Young Duckling Domesticated White Pekin Breast Meat And Skin Boneless Cooked Roasted,Meats
171511,140,Duck Young Duckling Domesticated White Pekin Breast Meat Only Boneless Cooked Without Skin Broiled,Meats
171512,292,Chicken Patty Frozen Uncooked,Meats
171513,287,Chicken Patty Frozen Cooked,Meats
171514,252,Chicken Breast Tenders Breaded Cooked Microwaved,Meats
171515,263,Chicken Breast Tenders Breaded Uncooked,Meats
171516,186,Chicken Broiler Rotisserie BBQ Wing Meat Only,Meats
171517,205,Chicken Broilers Or Fryers Back Meat Only Cooked Rotisserie Original Seasoning,Meats
171518,137,Chicken Broilers Or Fryers Breast Meat Only Cooked Rotisserie Original Seasoning,Meats
171519,176,Chicken Broilers Or Fryers Drumstick Meat Only Cooked Rotisserie Original Seasoning,Meats
171520,406,Chicken Broilers Or Fryers Skin Only Cooked Rotisserie Original Seasoning,Meats
171521,215,Chicken Broilers Or Fryers Drumstick Meat And Skin Cooked Rotisserie Original Seasoning,Meats
171522,233,Chicken Broilers Or Fryers Thigh Meat And Skin Cooked Rotisserie Original Seasoning,Meats
171523,266,Chicken Broilers Or Fryers Wing Meat And Skin Cooked Rotisserie Original Seasoning,Meats
171524,378,Chicken Broiler Rotisserie BBQ Skin,Meats
171525,115,Turkey Drumstick From Whole Bird Meat Only With Added Solution Raw,Meats
171526,102,Turkey Wing From Whole Bird Meat Only With Added Solution Raw,Meats
171527,127,Turkey Wing From Whole Bird Meat Only With Added Solution Roasted,Meats
171528,155,Turkey Retail Parts Breast Meat And Skin Raw,Meats
171529,164,Turkey Retail Parts Breast Meat And Skin Cooked Roasted,Meats
171530,139,Roasted Turkey Drumstick,Meats
171531,108,Turkey Thigh From Whole Bird Meat Only Raw,Meats
171532,165,Roasted Turkey Thigh,Meats
171533,161,Turkey Retail Parts Thigh Meat And Skin Raw,Meats
171534,151,Chicken Broiler Or Fryers Breast Skinless Boneless Meat Only Cooked Grilled,Meats
171535,145,Chicken Broiler Or Fryers Breast Skinless Boneless Meat Only With Added Solution Cooked Braised,Meats
171536,148,Chicken Broiler Or Fryers Breast Skinless Boneless Meat Only With Added Solution Cooked Grilled,Meats
171537,69,Soup Cream Of Asparagus Canned Condensed,Soups and Sauces
171538,7,Soup Beef Broth Or Bouillon Canned Ready-To-Serve,Soups and Sauces
171539,67,Soup Beef Noodle Canned Condensed,Soups and Sauces
171540,72,Soup Cream Of Celery Canned Condensed,Soups and Sauces
171541,82,Soup Cheese Canned Condensed,Soups and Sauces
171542,31,Soup Chicken Broth Canned Condensed,Soups and Sauces
171543,48,Soup Chicken Noodle Canned Condensed,Soups and Sauces
171544,53,Soup Chicken Rice Canned Chunky Ready-To-Serve,Soups and Sauces
171545,68,Soup Chicken With Rice Canned Condensed,Soups and Sauces
171546,33,Soup Chicken And Vegetable Canned Ready-To-Serve,Soups and Sauces
171547,72,Soup Clam Chowder New England Canned Condensed,Soups and Sauces
171548,11,Soup Beef Broth Bouillon And Consomme Canned Condensed,Soups and Sauces
171549,56,Soup Lentil With Ham Canned Ready-To-Serve,Soups and Sauces
171550,53,Canned Minestrone,Soups and Sauces
171551,46,Soup Onion Canned Condensed,Soups and Sauces
171552,88,Soup Cream Of Onion Canned Condensed,Soups and Sauces
171553,48,Soup Oyster Stew Canned Condensed,Soups and Sauces
171554,125,Soup Pea Green Canned Condensed,Soups and Sauces
171555,77,Soup Pea Split With Ham Canned Chunky Ready-To-Serve,Soups and Sauces
171556,47,Campbells Red And White Chicken Noodle Soup Condensed,Soups and Sauces
171557,93,Soup Tomato Rice Canned Condensed,Soups and Sauces
171558,57,Soup Turkey Chunky Canned Ready-To-Serve,Soups and Sauces
171559,39,Soup Chunky Vegetable Canned Ready-To-Serve,Soups and Sauces
171560,213,Soup Beef Broth Or Bouillon Powder Dry,Soups and Sauces
171561,170,Soup Beef Broth Cubed Dry,Soups and Sauces
171562,267,Soup Chicken Broth Or Bouillon Dry,Soups and Sauces
171563,198,Soup Chicken Broth Cubes Dry,Soups and Sauces
171564,53,Gravy Beef Canned Ready-To-Serve,Soups and Sauces
171565,367,Gravy Brown Dry,Soups and Sauces
171566,48,Gravy Chicken Canned Or Bottled Ready-To-Serve,Soups and Sauces
171567,381,Gravy Chicken Dry,Soups and Sauces
171568,51,Gravy Turkey Canned Ready-To-Serve,Soups and Sauces
171569,367,Gravy Turkey Dry,Soups and Sauces
171570,344,Gravy Unspecified Type Dry,Soups and Sauces
171571,377,Soup Chicken Noodle Dry Mix,Soups and Sauces
171572,30,Soup Beef Mushroom Canned Prepared With Equal Volume Water,Soups and Sauces
171573,54,Soup Chicken Mushroom Canned Prepared With Equal Volume Water,Soups and Sauces
171574,50,Soup Tomato Bisque Canned Prepared With Equal Volume Water,Soups and Sauces
171575,179,Sauce Peanut Made From Coconut Water Sugar Peanuts,Soups and Sauces
171576,55,Smart Soup Santa Fe Corn Chowder,Soups and Sauces
171577,53,Smart Soup French Lentil,Soups and Sauces
171578,40,Smart Soup Greek Minestrone,Soups and Sauces
171579,418,Pesto,Soups and Sauces
171580,426,Sauce Pesto Ready-To-Serve Shelf Stable,Soups and Sauces
171581,418,Sauce Pesto Buitoni Pesto With Basil Ready-To-Serve Refrigerated,Soups and Sauces
171582,372,Sauce Pesto Classico Basil Pesto Ready-To-Serve,Soups and Sauces
171583,5,Vegetable Broth,Soups and Sauces
171584,438,Sauce Cheese Sauce Mix Dry,Soups and Sauces
171585,99,Soup Chicken Corn Chowder Chunky Ready-To-Serve Single Brand,Soups and Sauces
171586,117,Soup Bean With Bacon Condensed Single Brand,Soups and Sauces
171587,65,Soup Tomato Canned Condensed Reduced Sodium,Soups and Sauces
171588,380,Gravy Brown Instant Dry,Soups and Sauces
171589,369,Gravy Instant Beef Dry,Soups and Sauces
171590,409,Gravy Instant Turkey Dry,Soups and Sauces
171591,30,Soup Tomato Low Sodium With Water,Soups and Sauces
171592,62,Soup Pea Low Sodium Prepared With Equal Volume Water,Soups and Sauces
171593,25,Soup Chicken Noodle Low Sodium Canned Prepared With Equal Volume Water,Soups and Sauces
171594,33,Soup Vegetable Soup Condensed Low Sodium Prepared With Equal Volume Water,Soups and Sauces
171595,92,Sauce Tomato Chili Sauce Bottled With Salt,Soups and Sauces
171596,69,Soup Vegetable Chicken Canned Prepared With Water Low Sodium,Soups and Sauces
171597,51,Sauce Pasta Spaghetti/marinara Ready-To-Serve Low Sodium,Soups and Sauces
171598,53,Gravy Meat Or Poultry Low Sodium Prepared,Soups and Sauces
171599,39,Gravy Heinz Home Style Savory Beef,Soups and Sauces
171600,51,Gravy Campbells Chicken,Soups and Sauces
171601,173,Barbecue Loaf Pork Beef,Meats
171602,58,Soup Cream Of Chicken Canned Condensed Reduced Sodium,Soups and Sauces
171603,535,Sauce Alfredo Mix Dry,Soups and Sauces
171604,21,Sauce Peppers Hot Chili Mature Red Canned,Soups and Sauces
171605,20,Sauce Chili Peppers Hot Immature Green Canned,Soups and Sauces
171606,16,Fish Broth,Soups and Sauces
171607,53,Soup Cream Of Mushroom Low Sodium Ready-To-Serve Canned,Soups and Sauces
171608,343,Potato Soup Instant Dry Mix,Soups and Sauces
171609,16,Soup Chicken Broth Low Sodium Canned,Soups and Sauces
171610,77,Worcestershire Sauce,Soups and Sauces
171611,69,Soup Beef And Mushroom Low Sodium Chunk Style,Soups and Sauces
171612,98,Soup Beef Stroganoff Canned Chunky Style Ready-To-Serve,Soups and Sauces
171613,438,Soup Bouillon Cubes And Granules Low Sodium Dry,Soups and Sauces
171614,441,Soup Ramen Noodle Beef Flavor Dry,Soups and Sauces
171615,439,Soup Ramen Noodle Chicken Flavor Dry,Soups and Sauces
171616,238,Pork Beerwurst,Meats
171617,230,Berliner Sausage,Meats
171618,379,Blood Sausage,Meats
171619,301,Bockwurst Pork Veal Raw,Meats
171620,333,Pork Bratwurst,Meats
171621,327,Braunschweiger Pork Liver Sausage,Meats
171622,323,Brotwurst Pork Beef Link,Meats
171623,328,Cheesefurter Cheese Smokie Pork Beef,Meats
171624,223,Chicken Hotdog,Meats
171625,223,Turkey Hotdog,Meats
171626,239,Canned Ham,Meats
171627,221,Ham Chopped Not Canned,Meats
171628,241,Ham And Cheese Loaf Or Roll,Meats
171629,245,Ham And Cheese Spread,Meats
171630,157,Headcheese Pork,Meats
171631,290,Sausage Italian Pork Raw,Meats
171632,342,Pork And Turkey Sausage Pre-Cooked,Meats
171633,298,Frankfurter Meat And Poultry Cooked Boiled,Meats
171634,302,Frankfurter Meat And Poultry Cooked Grilled,Meats
171635,217,Pork Sausage Link/patty Reduced Fat Unprepared,Meats
171636,267,Pork Sausage Link/patty Reduced Fat Cooked Pan-Fried,Meats
171637,281,Bologna Meat And Poultry,Meats
171638,286,Meatballs Frozen Italian Style,Meats
171639,368,Turkey Bacon Microwaved,Meats
171640,253,Bacon Turkey Low Sodium,Meats
171641,389,Post Alpha-Bits,Breakfast Cereals
171642,398,Quaker Capn Crunch,Breakfast Cereals
171643,397,Quaker Capn Crunch With Crunchberries,Breakfast Cereals
171644,417,Quaker Capn Crunchs Peanut Butter Crunch,Breakfast Cereals
171645,402,Post Fruity Pebbles,Breakfast Cereals
171646,489,Granola Homemade,Breakfast Cereals
171647,361,Post Grape-Nuts Cereal,Breakfast Cereals
171648,376,Post Grape-Nuts Flakes,Breakfast Cereals
171649,406,Quaker Sweet Crunch/quisp,Breakfast Cereals
171650,324,Post Raisin Bran Cereal,Breakfast Cereals
171651,383,Quaker Quaker Puffed Rice,Breakfast Cereals
171652,380,Post Golden Crisp,Breakfast Cereals
171653,372,Sun Country Kretschmer Honey Crunch Wheat Germ,Breakfast Cereals
171654,370,Corn Grits White Regular And Quick Enriched Dry,Breakfast Cereals
171655,71,White Cornmeal (Grits),Breakfast Cereals
171656,343,Quaker Corn Grits Instant Plain Dry,Breakfast Cereals
171657,50,Cream Of Wheat Regular (10 Minute) Cooked With Water Without Salt,Breakfast Cereals
171658,360,Farina Enriched Assorted Brands Including Cream Of Wheat Quick (1-3 Minutes) Dry,Breakfast Cereals
171659,55,Farina Enriched Assorted Brands Including Cream Of Wheat Quick (1-3 Minutes) Cooked With Wat,Breakfast Cereals
171660,366,Cream Of Wheat Instant Dry,Breakfast Cereals
171661,362,Oats Instant Fortified Plain Dry,Breakfast Cereals
171662,68,Oats Instant Fortified Plain Prepared With Water (Boiling Water Added Or Microwaved),Breakfast Cereals
171663,366,Quaker Instant Oatmeal Apples And Cinnamon Dry,Breakfast Cereals
171664,369,Oats Instant Fortified With Cinnamon And Spice Dry,Breakfast Cereals
171665,357,Wheatena Dry,Breakfast Cereals
171666,56,Wheatena Cooked With Water,Breakfast Cereals
171667,342,Whole Wheat Hot Natural Cereal Dry,Breakfast Cereals
171668,62,Whole Wheat Hot Natural Cereal Cooked With Water Without Salt,Breakfast Cereals
171669,366,Quaker Quaker Puffed Wheat,Breakfast Cereals
171670,371,Corn Grits Yellow Regular And Quick Unenriched Dry,Breakfast Cereals
171671,71,Corn Grits White Regular And Quick Enriched Cooked With Water With Salt,Breakfast Cereals
171672,65,Yellow Cornmeal (Grits),Grains and Pasta
171673,65,Corn Grits Yellow Regular Quick Enriched Cooked With Water With Salt,Breakfast Cereals
171674,363,Malt-O-Meal Chocolate Dry,Breakfast Cereals
171675,71,Oats Regular And Quick And Instant Unenriched Cooked With Water (Includes Boiling And Microw,Breakfast Cereals
171676,59,Wheatena Cooked With Water With Salt,Breakfast Cereals
171677,62,Whole Wheat Hot Natural Cereal Cooked With Water With Salt,Breakfast Cereals
171678,350,Malt-O-Meal Blueberry Mini Spooners,Breakfast Cereals
171679,396,Malt-O-Meal Oat Blenders With Honey,Breakfast Cereals
171680,379,Malt-O-Meal Oat Blenders With Honey & Almonds,Breakfast Cereals
171681,387,Malt-O-Meal Honey Nut Scooters,Breakfast Cereals
171682,366,Quaker Instant Oatmeal Cinnamon Swirl High Fiber,Breakfast Cereals
171683,386,Quaker Oatmeal Real Medleys Blueberry Hazelnut Dry,Breakfast Cereals
171684,390,Quaker Oatmeal Real Medleys Apple Walnut Dry,Breakfast Cereals
171685,353,Quaker Oatmeal Real Medleys Summer Berry Dry,Breakfast Cereals
171686,32,Acerola Cherries (West Indian Cherry),Fruits
171687,23,Acerola Juice Raw,Fruits
171688,52,Apples,Fruits
