ID,Calories,name,Food Group
784176,203,Pink Beans Dry Cooked Ns As To Fat Added In Cooking,Beans and Lentils
784177,148,Pink Beans Dry Cooked Fat Not Added In Cooking,Beans and Lentils
784178,203,Pink Beans Dry Cooked Fat Added In Cooking,Beans and Lentils
784179,200,Pink Beans Canned Drained Fat Added In Cooking,Beans and Lentils
784180,148,Pink Beans Canned Drained Fat Not Added In Cooking,Beans and Lentils
784181,197,Pinto Calico Or Red Mexican Beans Dry Cooked Ns As To Fat Added In Cooking,Beans and Lentils
784182,197,Pinto Calico Or Red Mexican Beans Dry Cooked Fat Added In Cooking Ns As To Type Of Fat,Beans and Lentils
784183,197,Pinto Calico Or Red Mexican Beans Dry Cooked Made With Oil,Beans and Lentils
784184,191,Pinto Calico Or Red Mexican Beans Dry Cooked Made With Animal Fat Or Meat Drippings,Beans and Lentils
784185,172,Pinto Calico Or Red Mexican Beans Dry Cooked Made With Margarine,Beans and Lentils
784186,142,Pinto Calico Or Red Mexican Beans Dry Cooked Fat Not Added In Cooking,Beans and Lentils
784187,189,Pinto Calico Or Red Mexican Beans Canned Drained Ns As To Fat Added In Cooking,Beans and Lentils
784188,189,Pinto Calico Or Red Mexican Beans Canned Drained Fat Added In Cooking Ns As To Type Of Fat,Beans and Lentils
784189,189,Pinto Calico Or Red Mexican Beans Canned Drained Made With Oil,Beans and Lentils
784190,183,Pinto Calico Or Red Mexican Beans Canned Drained Made With Animal Fat Or Meat Drippings,Beans and Lentils
784191,166,Pinto Calico Or Red Mexican Beans Canned Drained Made With Margarine,Beans and Lentils
784192,137,Pinto Calico Or Red Mexican Beans Canned Drained Fat Not Added In Cooking,Beans and Lentils
784193,189,Pinto Calico Or Red Mexican Beans Canned Drained Low Sodium Ns As To Fat Added In Cooking,Beans and Lentils
784194,189,Pinto Calico Or Red Mexican Beans Canned Drained Low Sodium Fat Added In Cooking,Beans and Lentils
784195,137,Pinto Calico Or Red Mexican Beans Canned Drained Low Sodium Fat Not Added In Cooking,Beans and Lentils
784196,180,Red Kidney Beans Dry Cooked Ns As To Fat Added In Cooking,Beans and Lentils
784197,180,Red Kidney Beans Dry Cooked Fat Added In Cooking Ns As To Type Of Fat,Beans and Lentils
784198,180,Red Kidney Beans Dry Cooked Made With Oil,Beans and Lentils
784199,174,Red Kidney Beans Dry Cooked Made With Animal Fat Or Meat Drippings,Beans and Lentils
784200,157,Red Kidney Beans Dry Cooked Made With Margarine,Beans and Lentils
784201,126,Red Kidney Beans Dry Cooked Fat Not Added In Cooking,Beans and Lentils
784202,188,Red Kidney Beans Canned Drained Fat Added In Cooking Ns As To Type Of Fat,Beans and Lentils
784203,188,Red Kidney Beans Canned Drained Made With Oil,Beans and Lentils
784204,135,Red Kidney Beans Canned Drained Fat Not Added In Cooking,Beans and Lentils
784205,188,Red Kidney Beans Canned Drained Low Sodium Ns As To Fat Added In Cooking,Beans and Lentils
784206,188,Red Kidney Beans Canned Drained Low Sodium Fat Added In Cooking,Beans and Lentils
784207,135,Red Kidney Beans Canned Drained Low Sodium Fat Not Added In Cooking,Beans and Lentils
784208,195,Yellow Canary Or Peruvian Beans Dry Cooked Ns As To Fat Added In Cooking,Beans and Lentils
784209,195,Yellow Canary Or Peruvian Beans Dry Cooked Fat Added In Cooking Ns As To Type Of Fat,Beans and Lentils
784210,195,Yellow Canary Or Peruvian Beans Dry Cooked Made With Oil,Beans and Lentils
784211,189,Yellow Canary Or Peruvian Beans Dry Cooked Made With Animal Fat Or Meat Drippings,Beans and Lentils
784212,172,Yellow Canary Or Peruvian Beans Dry Cooked Made With Margarine,Beans and Lentils
784213,143,Yellow Canary Or Peruvian Beans Dry Cooked Fat Not Added In Cooking,Beans and Lentils
784214,195,Yellow Canary Or Peruvian Beans Canned Drained Fat Added In Cooking Ns As To Type Of Fat,Beans and Lentils
784215,171,Soybeans Dry Cooked Fat Not Added In Cooking,Beans and Lentils
784216,223,Soybeans Dry Cooked Fat Added In Cooking,Beans and Lentils
784217,223,Soybeans Dry Cooked Ns As To Fat Added In Cooking,Beans and Lentils
784218,104,Mung Beans Dry Cooked Fat Not Added In Cooking,Beans and Lentils
784219,154,Mung Beans Dry Cooked Fat Added In Cooking,Beans and Lentils
784220,154,Mung Beans Dry Cooked Ns As To Fat Added In Cooking,Beans and Lentils
784221,159,Mung Beans Canned Drained Ns As To Fat Added In Cooking,Beans and Lentils
784225,141,Beans And Tomatoes Ns As To Fat Added In Cooking,Beans and Lentils
784226,101,Beans And Tomatoes Fat Not Added In Cooking,Beans and Lentils
784227,141,Beans And Tomatoes Fat Added In Cooking,Beans and Lentils
784228,109,Black Bean Salad,Beans and Lentils
784230,144,Refried Beans Fat Added In Cooking Ns As To Type Of Fat,Beans and Lentils
784231,144,Refried Beans Made With Oil,Beans and Lentils
784232,140,Refried Beans Made With Animal Fat Or Meat Drippings,Beans and Lentils
784233,129,Refried Beans Made With Margarine,Beans and Lentils
784235,144,Refried Beans Ns As To Fat Added In Cooking,Beans and Lentils
784237,107,Refried Beans With Cheese,Beans and Lentils
784238,116,Refried Beans With Meat,Beans and Lentils
784241,145,Layer Dip,Soups and Sauces
784242,260,Hummus Plain,Soups and Sauces
784243,258,Hummus Flavored,Soups and Sauces
784244,218,Black Bean Sauce,Soups and Sauces
784245,138,Beans And Franks,Beans and Lentils
784246,203,Beans Dry Cooked With Ground Beef,Beans and Lentils
784248,189,Beans Dry Cooked With Pork,Beans and Lentils
784250,408,Bean Cake,Beans and Lentils
784251,136,Stewed Beans With Pork Tomatoes And Chili Peppers Mexican Style,Beans and Lentils
784252,84,Stewed Red Beans Puerto Rican Style,Beans and Lentils
784253,86,Stewed Pink Beans With White Potatoes And Ham Puerto Rican Style,Beans and Lentils
784254,143,Stewed Pink Beans With Pig's Feet Puerto Rican Style,Beans and Lentils
784255,142,Stewed Red Beans With Pig's Feet Puerto Rican Style,Beans and Lentils
784256,151,Stewed Red Beans With Pig's Feet And Potatoes Puerto Rican Style,Beans and Lentils
784257,109,Black Beans Cuban Style,Beans and Lentils
784258,42,Chili With Beans Without Meat,Beans and Lentils
784259,172,Cowpeas Dry Cooked Ns As To Fat Added In Cooking,Beans and Lentils
784260,172,Cowpeas Dry Cooked Fat Added In Cooking,Beans and Lentils
784261,115,Cowpeas Dry Cooked Fat Not Added In Cooking,Beans and Lentils
784262,218,Chickpeas Dry Cooked Ns As To Fat Added In Cooking,Beans and Lentils
784263,218,Chickpeas Dry Cooked Fat Added In Cooking Ns As To Type Of Fat,Beans and Lentils
784264,218,Chickpeas Dry Cooked Made With Oil,Beans and Lentils
784265,212,Chickpeas Dry Cooked Made With Animal Fat Or Meat Drippings,Beans and Lentils
784266,193,Chickpeas Dry Cooked Made With Margarine,Beans and Lentils
784267,163,Chickpeas Dry Cooked Fat Not Added In Cooking,Beans and Lentils
784268,198,Chickpeas Canned Drained Ns As To Fat Added In Cooking,Beans and Lentils
784269,198,Chickpeas Canned Drained Fat Added In Cooking Ns As To Type Of Fat,Beans and Lentils
784270,198,Chickpeas Canned Drained Made With Oil,Beans and Lentils
784271,146,Chickpeas Canned Drained Fat Not Added In Cooking,Beans and Lentils
784272,199,Chickpeas Canned Drained Low Sodium Ns As To Fat Added In Cooking,Beans and Lentils
784273,199,Chickpeas Canned Drained Low Sodium Fat Added In Cooking,Beans and Lentils
784274,147,Chickpeas Canned Drained Low Sodium Fat Not Added In Cooking,Beans and Lentils
784275,117,Green Or Yellow Split Peas Dry Cooked Fat Not Added In Cooking,Beans and Lentils
784276,167,Green Or Yellow Split Peas Dry Cooked Fat Added In Cooking Ns As To Type Of Fat,Beans and Lentils
784277,167,Green Or Yellow Split Peas Dry Cooked Made With Oil,Beans and Lentils
784278,162,Green Or Yellow Split Peas Dry Cooked Made With Animal Fat Or Meat Drippings,Beans and Lentils
784279,146,Green Or Yellow Split Peas Dry Cooked Made With Margarine,Beans and Lentils
784280,167,Green Or Yellow Split Peas Dry Cooked Ns As To Fat Added In Cooking,Beans and Lentils
784282,169,Peas Dry Cooked With Pork,Beans and Lentils
784283,173,Cowpeas Dry Cooked With Pork,Beans and Lentils
784284,165,Lentils Dry Cooked Ns As To Fat Added In Cooking,Beans and Lentils
784285,165,Lentils Dry Cooked Fat Added In Cooking Ns As To Type Of Fat,Beans and Lentils
784286,165,Lentils Dry Cooked Made With Oil,Beans and Lentils
784287,159,Lentils Dry Cooked Made With Animal Fat Or Meat Drippings,Beans and Lentils
784288,143,Lentils Dry Cooked Made With Margarine,Beans and Lentils
784289,115,Lentils Dry Cooked Fat Not Added In Cooking,Beans and Lentils
784290,72,Loaf Lentil,Beans and Lentils
784291,89,Stewed Chickpeas Puerto Rican Style,Beans and Lentils
784292,160,Stewed Chickpeas With Potatoes Puerto Rican Style,Beans and Lentils
784293,151,Chickpeas Stewed With Pig's Feet Puerto Rican Style,Beans and Lentils
784294,212,Stewed Chickpeas With Spanish Sausages Puerto Rican Style,Beans and Lentils
784295,309,Fried Chickpeas With Bacon Puerto Rican Style,Beans and Lentils
784296,450,Bean Chips,Snacks
784298,84,Sambar Vegetable Stew,Vegetables
784304,155,Miso Sauce,Soups and Sauces
784315,150,Soybean Curd Breaded Fried,Beans and Lentils
784317,126,Vermicelli Made From Soybeans,Grains and Pasta
784319,261,Tofu Frozen Dessert Flavors Other Than Chocolate,Dairy and Egg Products 
784320,237,Tofu Frozen Dessert Chocolate,Dairy and Egg Products 
784321,68,Bean Soup Nfs,Soups and Sauces
784322,68,Bean With Bacon Or Ham Soup Canned Or Ready-To-Serve,Soups and Sauces
784324,58,Lima Bean Soup Home Recipe Canned Or Ready-To-Serve,Soups and Sauces
784325,32,Soybean Soup Miso Broth,Soups and Sauces
784326,142,Pinto Bean Soup Home Recipe Canned Or Ready-To-Serve,Soups and Sauces
784327,90,Bean Soup With Macaroni Home Recipe Canned Or Ready-To-Serve,Soups and Sauces
784328,109,Portuguese Bean Soup Home Recipe Canned Or Ready-To-Serve,Soups and Sauces
784330,63,Bean Soup Mixed Beans Home Recipe Canned Or Ready-To-Serve,Soups and Sauces
784331,65,Bean Soup Home Recipe,Soups and Sauces
784333,82,Bean And Ham Soup Home Recipe,Soups and Sauces
784336,71,Garbanzo Bean Or Chickpea Soup Home Recipe Canned Or Ready-To-Serve,Soups and Sauces
784341,64,Lentil Soup Home Recipe Canned Or Ready-To-Serve,Soups and Sauces
784351,180,Swiss Steak With Gravy Meatless,Beans and Lentils
784353,224,Vegetarian Pot Pie,Beans and Lentils
784354,107,Vegetarian Chili Made With Meat Substitute,Beans and Lentils
784355,89,Tofu And Vegetables Including Carrots Broccoli And/or Dark-Green Leafy; No Potatoes With Soy-Based Sauce,Prepared Meals
784356,90,Tofu And Vegetables Excluding Carrots Broccoli And Dark-Green Leafy; No Potatoes With Soy-Based Sauce,Prepared Meals
784358,31,Vegetarian Stew,Beans and Lentils
784359,166,Vegetarian Stroganoff,Beans and Lentils
784361,208,Soyburger Meatless With Cheese On Bun,Beans and Lentils
784362,605,Nuts Nfs,Nuts and Seeds
784365,601,Almonds Salted,Nuts and Seeds
784367,607,Almonds Unsalted,Nuts and Seeds
784368,599,Almonds Flavored,Nuts and Seeds
784369,575,Almonds Honey Roasted,Nuts and Seeds
784374,580,Cashews Lightly Salted,Nuts and Seeds
784375,583,Cashews Unsalted,Nuts and Seeds
784382,605,Mixed Nuts Nfs,Nuts and Seeds
784383,606,Mixed Nuts Unroasted,Nuts and Seeds
784386,610,Mixed Nuts With Peanuts Unsalted,Nuts and Seeds
784387,610,Mixed Nuts Without Peanuts Salted,Nuts and Seeds
784388,615,Mixed Nuts Without Peanuts Unsalted,Nuts and Seeds
784389,579,Mixed Nuts Honey Roasted,Nuts and Seeds
784396,584,Peanuts Dry Roasted Lightly Salted,Nuts and Seeds
784401,690,Pecans Salted,Nuts and Seeds
784402,697,Pecans Unsalted,Nuts and Seeds
784403,637,Pecans Honey Roasted,Nuts and Seeds
784406,576,Pistachio Nuts Salted,Nuts and Seeds
784407,579,Pistachio Nuts Lightly Salted,Nuts and Seeds
784408,581,Pistachio Nuts Unsalted,Nuts and Seeds
784411,612,Walnuts Honey Roasted,Nuts and Seeds
784418,624,Peanut Butter Lower Sodium And Lower Sugar,Nuts and Seeds
784422,432,Peanut Butter And Jelly,Nuts and Seeds
784423,498,Peanut Butter And Chocolate Spread,Nuts and Seeds
784425,124,Brown Nut Gravy Meatless,Soups and Sauces
784426,381,Peanut Butter Sandwich Nfs,NULL
784427,381,Peanut Butter Sandwich With Regular Peanut Butter On White Bread,NULL
784428,379,Peanut Butter Sandwich With Regular Peanut Butter On Wheat Bread,NULL
784429,379,Peanut Butter Sandwich With Regular Peanut Butter On Whole Wheat Bread,NULL
784430,354,Peanut Butter Sandwich With Reduced Fat Peanut Butter On White Bread,NULL
784431,352,Peanut Butter Sandwich With Reduced Fat Peanut Butter On Wheat Bread,NULL
784432,352,Peanut Butter Sandwich With Reduced Fat Peanut Butter On Whole Wheat Bread,NULL
784433,361,Peanut Butter And Jelly Sandwich Nfs,NULL
784434,361,Peanut Butter And Jelly Sandwich With Regular Peanut Butter Regular Jelly On White Bread,NULL
784435,359,Peanut Butter And Jelly Sandwich With Regular Peanut Butter Regular Jelly On Wheat Bread,NULL
784436,359,Peanut Butter And Jelly Sandwich With Regular Peanut Butter Regular Jelly On Whole Wheat Bread,NULL
784437,339,Peanut Butter And Jelly Sandwich With Reduced Fat Peanut Butter Regular Jelly On White Bread,NULL
784438,337,Peanut Butter And Jelly Sandwich With Reduced Fat Peanut Butter Regular Jelly On Wheat Bread,NULL
784439,337,Peanut Butter And Jelly Sandwich With Reduced Fat Peanut Butter Regular Jelly On Whole Wheat Bread,NULL
784440,340,Peanut Butter And Jelly Sandwich With Regular Peanut Butter Reduced Sugar Jelly On White Bread,NULL
784441,339,Peanut Butter And Jelly Sandwich With Regular Peanut Butter Reduced Sugar Jelly On Wheat Bread,NULL
784442,339,Peanut Butter And Jelly Sandwich With Regular Peanut Butter Reduced Sugar Jelly On Whole Wheat Bread,NULL
784443,318,Peanut Butter And Jelly Sandwich With Reduced Fat Peanut Butter Reduced Sugar Jelly On White Bread,NULL
784444,316,Peanut Butter And Jelly Sandwich With Reduced Fat Peanut Butter Reduced Sugar Jelly On Wheat Bread,NULL
784445,316,Peanut Butter And Jelly Sandwich With Reduced Fat Peanut Butter Reduced Sugar Jelly On Whole Wheat Bread,NULL
784446,361,Peanut Butter And Jelly Sandwich Frozen Commercial Product Without Crusts,NULL
784448,64,Yogurt Coconut Milk,Dairy and Egg Products 
784451,38,Coconut Water Sweetened,Beverages
784452,452,Trail Mix Nfs,Nuts and Seeds
784453,600,Trail Mix With Nuts,Nuts and Seeds
784454,452,Trail Mix With Nuts And Fruit,Nuts and Seeds
784455,501,Trail Mix With Chocolate,Nuts and Seeds
784456,473,Trail Mix With Pretzels Cereal Or Granola,Nuts and Seeds
784458,567,Pumpkin Seeds Salted,Nuts and Seeds
784461,575,Sunflower Seeds Plain Salted,Nuts and Seeds
784462,567,Sunflower Seeds Flavored,Nuts and Seeds
784467,580,Mixed Seeds,Nuts and Seeds
784472,270,Bread Made From Home Recipe Or Purchased At A Bakery Ns As To Major Flour,Baked Foods
784473,297,Bread Made From Home Recipe Or Purchased At A Bakery Toasted Ns As To Major Flour,Baked Foods
784479,270,Bread White Made From Home Recipe Or Purchased At A Bakery,Baked Foods
784480,297,Bread White Made From Home Recipe Or Purchased At A Bakery Toasted,Baked Foods
784481,259,Bread White With Whole Wheat Swirl,Baked Foods
784482,298,Bread White With Whole Wheat Swirl Toasted,Baked Foods
784484,299,Bread Cuban Toasted,Baked Foods
784485,277,Bread Native Water Puerto Rican Style,Baked Foods
784486,305,Bread Native Water Toasted Puerto Rican Style,Baked Foods
784487,280,Bread Lard Puerto Rican Style,Baked Foods
784488,311,Bread Lard Toasted Puerto Rican Style,Baked Foods
784489,273,Bread Caressed Puerto Rican Style,Baked Foods
784490,300,Bread Caressed Toasted Puerto Rican Style,Baked Foods
784494,311,Naan Indian Flatbread,Baked Foods
784495,271,Bread Italian Grecian Armenian,Baked Foods
784496,298,Bread Italian Grecian Armenian Toasted,Baked Foods
784498,302,Bread Pita Toasted,Baked Foods
784499,279,Bread Pita With Fruit,Baked Foods
784500,306,Bread Pita With Fruit Toasted,Baked Foods
784502,448,Bread Cheese Toasted,Baked Foods
784505,283,Bread Cornmeal And Molasses,Baked Foods
784506,311,Bread Cornmeal And Molasses Toasted,Baked Foods
784508,315,Bread Egg Challah Toasted,Baked Foods
784509,349,Garlic Bread Nfs,Baked Foods
784510,349,Garlic Bread From Fast Food / Restaurant,Baked Foods
784512,351,Garlic Bread With Parmesan Cheese From Fast Food / Restaurant,Baked Foods
784513,351,Garlic Bread With Parmesan Cheese From Frozen,Baked Foods
784514,338,Garlic Bread With Melted Cheese From Fast Food / Restaurant,Baked Foods
784515,343,Garlic Bread With Melted Cheese From Frozen,Baked Foods
784516,236,Bread Onion,Baked Foods
784517,260,Bread Onion Toasted,Baked Foods
784523,262,Bread White Special Formula Added Fiber Toasted,Baked Foods
784525,269,Bread High Protein Toasted,Baked Foods
784527,292,Bread Potato Toasted,Baked Foods
784528,269,Bread Raisin,Baked Foods
784529,296,Bread Raisin Toasted,Baked Foods
784531,293,Bread White Low Sodium Or No Salt Toasted,Baked Foods
784534,239,Bread Sweet Potato,Baked Foods
784535,263,Bread Sweet Potato Toasted,Baked Foods
784536,259,Bread Vegetable,Baked Foods
784537,285,Bread Vegetable Toasted,Baked Foods
784538,173,Bruschetta,Fast Foods
784539,382,Bread Dough Fried,Baked Foods
784546,315,Roll Cheese,Baked Foods
784548,309,Roll Garlic,Baked Foods
784556,379,Roll Sweet With Fruit Frosted,Baked Foods
784558,400,Roll Sweet Frosted,Baked Foods
784560,373,Pan Dulce With Sugar Topping,Baked Foods
784561,368,Pan Dulce With Raisins And Icing,Baked Foods
784565,421,Croissant Chocolate,Baked Foods
784566,396,Croissant Fruit,Baked Foods
784567,419,Brioche,Baked Foods
784568,344,Bread Spanish Coffee,Baked Foods
784569,264,Bagel,Baked Foods
784570,268,Bagel With Raisins,Baked Foods
784571,243,Bagel With Fruit Other Than Raisins,Baked Foods
784572,177,Bread Stuffing,Prepared Meals
784573,192,Bread Stuffing Made With Egg,Prepared Meals
784574,342,Breadsticks Nfs,Baked Foods
784576,431,Breadsticks Hard Reduced Sodium,Snacks
784577,342,Breadsticks Soft Nfs,Baked Foods
784578,342,Breadsticks Soft From Fast Food / Restaurant,Baked Foods
784579,312,Breadsticks Soft From Frozen,Baked Foods
784580,344,Breadsticks Soft With Parmesan Cheese From Fast Food / Restaurant,Baked Foods
784581,312,Breadsticks Soft With Parmesan Cheese From Frozen,Baked Foods
784582,333,Breadsticks Soft Topped With Melted Cheese,Baked Foods
784583,333,Breadsticks Soft Stuffed With Melted Cheese,Baked Foods
784586,234,Muffin English With Raisins,Baked Foods
784587,236,Muffin English Cheese,Baked Foods
784588,243,Muffin English With Fruit Other Than Raisins,Baked Foods
784591,321,Pannetone,Baked Foods
784594,262,Bread Whole Grain White Toasted,Baked Foods
784595,250,Bagel Whole Grain White,Baked Foods
784597,277,Bread Whole Wheat Toasted,Baked Foods
784598,248,Bread Whole Wheat Made From Home Recipe Or Purchased At Bakery,Baked Foods
784599,272,Bread Whole Wheat Made From Home Recipe Or Purchased At Bakery Toasted,Baked Foods
784601,396,Bread Puri Wheat,Baked Foods
784603,273,Bread Whole Wheat With Raisins,Baked Foods
784604,301,Bread Whole Wheat With Raisins Toasted,Baked Foods
784606,207,Bread Sprouted Wheat Toasted,Baked Foods
784608,301,Bread Wheat Or Cracked Wheat Toasted,Baked Foods
784609,263,Bread Wheat Or Cracked Wheat Made From Home Recipe Or Purchased At Bakery,Baked Foods
784610,289,Bread Wheat Or Cracked Wheat Made From Home Recipe Or Purchased At Bakery Toasted,Baked Foods
784611,285,Bread Wheat Or Cracked Wheat With Raisins,Baked Foods
784612,313,Bread Wheat Or Cracked Wheat With Raisins Toasted,Baked Foods
784616,263,Bread French Or Vienna Whole Wheat Toasted,Baked Foods
784618,288,Bread Pita Whole Wheat Toasted,Baked Foods
784620,288,Bread Pita Wheat Or Cracked Wheat Toasted,Baked Foods
784621,250,Bagel Wheat,Baked Foods
784622,250,Bagel Whole Wheat,Baked Foods
784623,255,Bagel Wheat With Raisins,Baked Foods
784624,255,Bagel Whole Wheat With Raisins,Baked Foods
784625,261,Bagel Wheat With Fruit And Nuts,Baked Foods
784626,250,Bagel Wheat Bran,Baked Foods
784628,231,Muffin English Wheat Bran With Raisins,Baked Foods
784631,230,Muffin English Wheat Or Cracked Wheat With Raisins,Baked Foods
784632,230,Muffin English Whole Wheat With Raisins,Baked Foods
784634,411,Breadsticks Hard Whole Wheat,Snacks
784647,285,Bread Marble Rye And Pumpernickel Toasted,Baked Foods
784652,275,Bread Pumpernickel Toasted,Baked Foods
784653,250,Bagel Pumpernickel,Baked Foods
784656,275,Bread Black Toasted,Baked Foods
784665,250,Bagel Oat Bran,Baked Foods
784668,272,Muffin English Oat Bran With Raisins,Baked Foods
784669,291,Bread Multigrain Toasted,Baked Foods
784671,268,Bread Multigrain With Raisins,Baked Foods
784672,295,Bread Multigrain With Raisins Toasted,Baked Foods
784678,250,Bagel Multigrain,Baked Foods
784679,255,Bagel Multigrain With Raisins,Baked Foods
784682,301,Bread Barley Toasted,Baked Foods
784683,258,Bread Soy,Baked Foods
784684,284,Bread Soy Toasted,Baked Foods
784685,304,Bread Sunflower Meal,Baked Foods
784686,334,Bread Sunflower Meal Toasted,Baked Foods
784688,273,Bread Rice Toasted,Baked Foods
784689,88,Injera Ethiopian Bread,Baked Foods
784691,273,Bread Gluten Free Toasted,Baked Foods
784695,350,Biscuit Dough Fried,Baked Foods
784696,193,Crumpet,Baked Foods
784697,217,Crumpet Toasted,Baked Foods
784698,324,Biscuit Baking Powder Or Buttermilk Type Made From Mix,Baked Foods
784702,354,Biscuit Baking Powder Or Buttermilk Type Made From Home Recipe,Baked Foods
784703,312,Biscuit Whole Wheat,Baked Foods
784704,346,Biscuit Cheese,Baked Foods
784705,345,Biscuit Cinnamon-Raisin,Baked Foods
784706,353,Scone,Baked Foods
784707,352,Scone With Fruit,Baked Foods
784709,283,Cornbread Made From Home Recipe,Baked Foods
784712,303,Cornbread Muffin Stick Round Made From Home Recipe,Baked Foods
784713,216,Corn Flour Patty Or Tart Fried,Baked Foods
784714,214,Corn Pone Baked,Baked Foods
784715,254,Corn Pone Fried,Baked Foods
784716,303,Gordita/sope Shell Plain No Filling,Baked Foods
784718,275,Johnnycake,Baked Foods
784719,164,Spoonbread,Baked Foods
784720,262,Tortilla Nfs,Baked Foods
784725,511,Taco Shell Flour,Baked Foods
784726,267,Arepa Dominicana,Baked Foods
784730,397,Muffin Chocolate Chip,Baked Foods
784731,390,Muffin Chocolate,Baked Foods
784732,355,Muffin Whole Wheat,Baked Foods
784733,360,Muffin Wheat,Baked Foods
784734,360,Muffin Whole Grain,Baked Foods
784735,215,Muffin Wheat Bran,Baked Foods
784737,362,Muffin Oatmeal,Baked Foods
784739,368,Muffin Plain,Baked Foods
784740,360,Muffin Cheese,Baked Foods
784741,300,Muffin Pumpkin,Baked Foods
784742,300,Muffin Zucchini,Baked Foods
784743,307,Muffin Carrot,Baked Foods
784744,265,Popover,Baked Foods
784746,392,Bread Nut,Baked Foods
784747,300,Bread Pumpkin,Baked Foods
784748,362,Bread Fruit,Baked Foods
784749,300,Bread Zucchini,Baked Foods
784750,297,Bread Irish Soda,Baked Foods
784751,290,Cake Batter Raw Chocolate,Baked Foods
784752,281,Cake Batter Raw Not Chocolate,Baked Foods
784755,333,Cake Angel Food With Icing Or Filling,Baked Foods
784756,209,Cake Angel Food With Fruit And Icing Or Filling,Baked Foods
784757,408,Cake Or Cupcake Applesauce Without Icing Or Filling,Baked Foods
784758,424,Cake Or Cupcake Applesauce With Icing Or Filling,Baked Foods
784759,424,Cake Or Cupcake Banana Without Icing Or Filling,Baked Foods
784760,435,Cake Or Cupcake Banana With Icing Or Filling,Baked Foods
784763,413,Cake Or Cupcake Carrot Without Icing Or Filling,Baked Foods
784764,428,Cake Or Cupcake Carrot With Icing Or Filling,Baked Foods
784768,209,Cheesecake With Fruit,Baked Foods
784769,374,Cheesecake Chocolate,Baked Foods
784771,326,Cake Or Cupcake Chocolate Devil's Food Or Fudge Without Icing Or Filling,Baked Foods
784772,401,Cake Or Cupcake German Chocolate With Icing Or Filling,Baked Foods
784774,370,Cake Cream Without Icing Or Topping,Baked Foods
784779,390,Cake Dobos Torte,Baked Foods
784781,308,Cake Or Cupcake Gingerbread,Baked Foods
784782,313,Cake Ice Cream And Cake Roll Chocolate,Baked Foods
784783,314,Cake Ice Cream And Cake Roll Not Chocolate,Baked Foods
784784,366,Cake Jelly Roll,Baked Foods
784785,344,Cake Or Cupcake Lemon Without Icing Or Filling,Baked Foods
784786,386,Cake Or Cupcake Lemon With Icing Or Filling,Baked Foods
784787,335,Cake Or Cupcake Marble Without Icing Or Filling,Baked Foods
784788,390,Cake Or Cupcake Marble With Icing Or Filling,Baked Foods
784789,425,Cake Or Cupcake Nut Without Icing Or Filling,Baked Foods
784790,404,Cake Or Cupcake Nut With Icing Or Filling,Baked Foods
784791,370,Cake Or Cupcake Oatmeal,Baked Foods
784792,413,Cake Or Cupcake Peanut Butter,Baked Foods
784794,403,Cake Pound With Icing Or Filling,Baked Foods
784795,414,Cake Pound Chocolate,Baked Foods
784796,465,Cake Pound Puerto Rican Style,Baked Foods
784798,387,Cake Or Cupcake Pumpkin Without Icing Or Filling,Baked Foods
784799,411,Cake Or Cupcake Pumpkin With Icing Or Filling,Baked Foods
784800,411,Cake Or Cupcake Raisin-Nut,Baked Foods
784801,274,Cake Ravani,Baked Foods
784802,262,Cake Rice Flour Without Icing Or Filling,Baked Foods
784804,408,Cake Or Cupcake Spice Without Icing Or Filling,Baked Foods
784805,424,Cake Or Cupcake Spice With Icing Or Filling,Baked Foods
784807,362,Cake Sponge With Icing Or Filling,Baked Foods
784808,354,Cake Sponge Chocolate,Baked Foods
784810,283,Cake Torte,Baked Foods
784811,267,Cake Tres Leche,Baked Foods
784812,331,Cake Pineapple Upside Down,Baked Foods
784814,329,Cake Or Cupcake White Without Icing Or Filling,Baked Foods
784816,344,Cake Or Cupcake Yellow Without Icing Or Filling,Baked Foods
784817,219,Cake Shortcake Biscuit Type With Whipped Cream And Fruit,Baked Foods
784818,217,Cake Shortcake Biscuit Type With Fruit,Baked Foods
784819,242,Cake Shortcake Sponge Type With Whipped Cream And Fruit,Baked Foods
784820,247,Cake Shortcake Sponge Type With Fruit,Baked Foods
784821,217,Cake Shortcake With Whipped Topping And Fruit Diet,Baked Foods
784822,437,Cake Or Cupcake Zucchini,Baked Foods
784823,431,Cookie Batter Or Dough Raw,Baked Foods
784827,366,Cookie Biscotti,Baked Foods
784830,401,Cookie Brownie With Icing Or Filling,Baked Foods
